{
  "member_label": "Member 1",
  "DM": "LRFD",
  "section": "Custom",
  "d": 10.1,
  "bt": 8.02,
  "tt": 0.62,
  "tw": 0.35,
  "Fy": 50,
  "Fu": 65,
  "lz": 30,
  "ly": 15,
  "kz": 1,
  "ky": 1,
  "lb": 1,
  "lt": 30,
  "Cb": 1.14,
  "Puc": 120,
  "Put": 100,
  "Vuz": 0,
  "Vuy": 0,
  "Muz": 70,
  "Muy": 70,
  "uid": "2002-steel-i-beam-capacity-calculator",
  "current_unit_system": "metric",
  "project_details": {
    "project_company": "",
    "project_name": "",
    "project_designer": "",
    "project_id": "",
    "project_client": "",
    "project_notes": ""
  }
}